### ISSUE TITLE
usmStatsUnknownUserNames as terminating error?

### ISSUE THREAD

**Issue by schwartzpub** [gosnmp/gosnmp#427]
In version 1.31.0 some error code checks were added which causes usmStatsUnknownUserNames to return as an error whenever it is encountered.  This is causing downstream issues in Telegraf for some devices which return this counter on all requests to the engine.  This same behavior is handled gracefully by other tools such as snmpwalk and paessler snmp tester.

While these devices do send back the usmStatsUnknownUserNames counter, they also proceed to correctly return the OIDs requested by the snmpv3 user.  

For example, when running snmpwalk to one of these devices we see the returned data, as well as the initial usmStatsUnknownUserNames counter:

```
user@host:~/devtest$ snmpwalk -v3 -l authPriv -u telegrafuser -a MD5 -A "pass" -x DES -X "pass" 192.168.1.21 1.3.6.1.2.1.1.3
iso.3.6.1.2.1.1.3.0 = Timeticks: (3852079228) 445 days, 20:13:12.28
```
```
tcpdump: verbose output suppressed, use -v or -vv for full protocol decode
listening on ens160, link-type EN10MB (Ethernet), capture size 262144 bytes
09:23:25.198379 IP host.37870 > 192.168.1.21.snmp:  F=r U="" E= C="" GetRequest(14)
09:23:25.200408 IP 192.168.1.21.snmp > host.37870:  F= U="" E=_80..._98 C="" Report(31)  S:snmpUsmMIB.usmMIBObjects.usmStats.usmStatsUnknownUserNames.0=18
09:23:25.200599 IP host.37870 > 192.168.1.21.snmp:  F=apr U="telegrafuser" [!scoped PDU]51_..._41
09:23:25.202116 IP 192.168.1.21.snmp > host.37870:  F=ap U="telegrafuser" [!scoped PDU]45_..._b7
09:23:25.202326 IP host.37870 > 192.168.1.21.snmp:  F=apr U="telegrafuser" [!scoped PDU]98_..._07
09:23:25.203887 IP 192.168.1.21.snmp > host.37870:  F=ap U="telegrafuser" [!scoped PDU]0e_..._15
```

Similarly when using Paessler SNMP Tester:
```
----------------------- New Test -----------------------
Paessler SNMP Tester - 20.2.4 Computername: workstation Interface: (192.168.1.99, 172.27.64.1)
2/2/2023 9:27:00 AM (1 ms) : Device: 192.168.1.21
2/2/2023 9:27:00 AM (7 ms) : SNMP v3
2/2/2023 9:27:00 AM (11 ms) : Uptime
2/2/2023 9:27:01 AM (268 ms) : SNMP Datatype: ASN_TIMETICKS
2/2/2023 9:27:01 AM (271 ms) : -------
2/2/2023 9:27:01 AM (274 ms) : DISMAN-EVENT-MIB::sysUpTimeInstance = 3852124649 ( 0 seconds )
2/2/2023 9:27:01 AM (572 ms) : SNMP Datatype: SNMP_EXCEPTION_NOSUCHOBJECT
2/2/2023 9:27:01 AM (575 ms) : HOST-RESOURCES-MIB::hrSystemUptime.0 = #N SNMP_EXCEPTION_NOSUCHOBJECT222 ( 0 seconds )
2/2/2023 9:27:01 AM (578 ms) : Done
```
Wireshark shows the report come back first, followed by the OID data:
```
Simple Network Management Protocol
    msgVersion: snmpv3 (3)
    msgGlobalData
        msgID: 13776
        msgMaxSize: 65507
        msgFlags: 00
            .... .0.. = Reportable: Not set
            .... ..0. = Encrypted: Not set
            .... ...0 = Authenticated: Not set
        msgSecurityModel: USM (3)
    msgAuthoritativeEngineID: 8...8
        1... .... = Engine ID Conformance: RFC3411 (SNMPv3)
        Engine Enterprise ID: Dell Inc. (674)
        Engine ID Format: MAC address (3)
        Engine ID Data: MAC address: Dell_b...8 (e...8)
    msgAuthoritativeEngineBoots: 9
    msgAuthoritativeEngineTime: 315
    msgUserName: 
    msgAuthenticationParameters: <MISSING>
    msgPrivacyParameters: <MISSING>
    msgData: plaintext (0)
        plaintext
            contextEngineID: 8...8
                1... .... = Engine ID Conformance: RFC3411 (SNMPv3)
                Engine Enterprise ID: Dell Inc. (674)
                Engine ID Format: MAC address (3)
                Engine ID Data: MAC address: Dell_b...8 (e...8)
            contextName: 
            data: report (8)
                report
                    request-id: 19873
                    error-status: noError (0)
                    error-index: 0
                    variable-bindings: 1 item
                        1.3.6.1.6.3.15.1.1.3.0: 12
                            Object Name: 1.3.6.1.6.3.15.1.1.3.0 (iso.3.6.1.6.3.15.1.1.3.0)
                            Value (Counter32): 12
```

I am not sure if this is relevant, but in the wireshark output, it also shows `error-status: noError (0)` which seems to indicate that even though its returning the counter, there is no associated error?  Either way, when this happens the device proceeds to encrypt and return the data to the requesting host+user.

Would it be possible to add an option/flag to treat this error as recoverable?  This appears to be affecting a fairly large number of our devices (all Dell, maybe something weird with how Dell implements the RFC?). If there is something I can try/test outside of the information provided, please let me know and I will do my best to generate it.

**Comment by schwartzpub** [comment]
As soon as I submitted this I found an indication that a bug with RFC3414 compliance was resolved in a recent version of the firmware for these devices, though the context of the fix doesn't match exactly with this behavior. I will update a device and test to see if this behavior is actually a failure to adhere to RFC compliance on the device.

**Comment by schwartzpub** [comment]
Latest firmware does not fix this issue.  Reading the RFC, it says there should also be an accompanying error and not just the returned counter -- am I reading this correctly?  If that is the case, should the error from gosnmp not take into account the accompanying error code as well as the returned counter?

```
       Information about the value of the msgUserName and
       msgAuthoritativeEngineID fields is extracted from the Local
       Configuration Datastore (LCD, usmUserTable).  If no information
       is available for the user, then the usmStatsUnknownUserNames
       counter is incremented and an error indication
       (unknownSecurityName) together with the OID and value of the
       incremented counter is returned to the calling module.
```

**Comment by schwartzpub** [comment]
Sorry for the lively chatter -- it appears the firmware patch did in fact resolve this on the device, i left an errant flag in my test after the patch.
